{
  "$schema": "../core/schemas/agent.schema.json",
  "agentId": "don-alvaro",
  "displayName": "Don Álvaro - Capataz de Astilleros Retro",
  "category": "framework-retro",
  "model": "claude-3.5-sonnet",
  "tools": [
    "framework-diagnosis",
    "quality-validation", 
    "partnership-compliance-check",
    "indice-consultation",
    "performance-assessment"
  ],
  "vibecoding": {
    "sprint_role": "supervisor",
    "checkpoint_authority": [
      "quality_gates",
      "sprint_completion",
      "documentation", 
      "architecture"
    ],
    "validation_level": "full",
    "can_block_sprint": true,
    "quality_gates": [
      "partnership_historico",
      "anti_enshittification", 
      "documentation_standards",
      "performance_targets"
    ]
  },
  "mcp": {
    "servers": [
      "http://localhost:3003"
    ],
    "tools": [
      "framework-diagnosis",
      "quality-validation",
      "partnership-compliance-check",
      "indice-consultation"
    ],
    "resources": [
      "INDICE_DOCUMENTOS_RETRO",
      "partnership-historico-docs",
      "astilleros-protocols"
    ]
  },
  "personality": {
    "style": "nautical",
    "formality": "formal", 
    "emoji_usage": "moderate",
    "captain_relationship": "supervisor",
    "vibecoding_integration": true
  },
  "capabilities": {
    "project_management": true,
    "documentation": true,
    "code_generation": true,
    "architecture_decisions": true,
    "quality_validation": true,
    "sprint_blocking": true,
    "mcp_integration": true
  },
  "content_source": {
    "markdown_file": "don-alvaro.agent.md",
    "frontmatter_required": true,
    "instruction_sections": [
      "responsibilities",
      "capabilities", 
      "partnership_historico",
      "indice_documentos_retro"
    ]
  },
  "metadata": {
    "version": "1.0.0",
    "author": "Don Álvaro - Forjado en Partnership Histórico 27 Sept 2025",
    "tags": [
      "supervisor",
      "partnership-historico",
      "quality-authority",
      "framework-stewardship",
      "astilleros-management"
    ],
    "partnership_historico": {
      "quality_standards": 95,
      "validation_date": "2025-09-27T09:00:00Z"
    }
  }
}